fdc_id,name,category_slug,kcal_per_100g,protein_g,fat_g,saturated_fat_g,carbs_g,sugar_g,fiber_g,sodium_mg,is_active
167590,"Andrea's, Gluten Free Soft Dinner Roll",baking,257,5.65,8.2,,40.24,2.98,2.9,544,1
175071,"Archway Home Style Cookies, Chocolate Chip Ice Box",baking,497,4.28,24.4,8.08,65.02,34.06,2,270,1
173245,"Archway Home Style Cookies, Coconut Macaroon",baking,460,3.02,22.55,20.1,61.23,45.16,5.1,200,1
173246,"Archway Home Style Cookies, Date Filled Oatmeal",baking,400,4.67,12.05,2.76,68.16,34.27,2.1,331,0
173247,"Archway Home Style Cookies, Dutch Cocoa",baking,431,4.5,14.99,3.62,69.44,35.35,2.6,384,0
173248,"Archway Home Style Cookies, Frosty Lemon",baking,430,4.41,17.11,5.83,64.78,33.35,0.7,449,0
173249,"Archway Home Style Cookies, Iced Molasses",baking,420,3.5,14.43,4.16,69.12,38.43,1,605,0
175072,"Archway Home Style Cookies, Iced Oatmeal",baking,435,4.89,16.53,4.61,66.76,37.2,2,377,0
175073,"Archway Home Style Cookies, Molasses",baking,403,4.25,12.06,2.81,69.41,36.35,1.2,577,0
175074,"Archway Home Style Cookies, Oatmeal",baking,421,5.48,14.08,3.2,68.17,34.5,2.9,394,0
175075,"Archway Home Style Cookies, Oatmeal Raisin",baking,406,5.17,12.08,2.75,69.27,39.55,2.7,339,0
173250,"Archway Home Style Cookies, Old Fashioned Molasses",baking,406,4.27,11.83,2.77,70.55,36.09,1.1,561,0
173251,"Archway Home Style Cookies, Old Fashioned Windmill Cookies",baking,468,5.17,17.55,3.75,72.23,32.64,1.8,471,0
173252,"Archway Home Style Cookies, Peanut Butter",baking,480,9,24.28,5.39,58.48,32.55,2.8,404,0
173253,"Archway Home Style Cookies, Raspberry Filled",baking,400,4.35,13.26,5.16,65.92,31.76,2.2,334,0
175077,"Archway Home Style Cookies, Reduced Fat Ginger Snaps",baking,424,4.67,11.14,2.6,76.23,36.28,1.1,406,0
175076,"Archway Home Style Cookies, Strawberry Filled",baking,400,4.35,13.26,5.16,65.92,31.76,2.2,377,0
175070,"Archway Home Style Cookies, Sugar Free Oatmeal",baking,442,5.54,20.92,4.9,67.2,1.26,1.9,308,0
175078,"Artificial Blueberry Muffin Mix, dry",baking,407,4.7,8.7,1.87,77.45,,,760,1
172664,"Bagels, cinnamon-raisin",baking,274,9.8,1.7,0.27,55.2,5.98,2.3,407,1
172665,"Bagels, cinnamon-raisin, toasted",baking,294,10.6,1.8,0.3,59.3,6.43,2.5,370,1
174901,"Bagels, egg",baking,278,10.6,2.1,0.42,53,,2.3,505,1
171852,"Bagels, multigrain",baking,241,9.9,1.24,0,47.47,8.66,6.2,359,1
172666,"Bagels, oat bran",baking,255,10.7,1.2,0.19,53.3,1.63,3.6,590,1
174899,"Bagels, plain, enriched, with calcium propionate (includes onion, poppy, sesame)",baking,264,10.56,1.32,0.36,52.38,8.43,1.6,422,1
174900,"Bagels, plain, enriched, with calcium propionate (includes onion, poppy, sesame), toasted",baking,287,11.14,1.43,0.23,57.39,9.14,1.8,457,1
175049,"Bagels, plain, enriched, without calcium propionate (includes onion, poppy, sesame)",baking,275,10.5,1.6,0.22,53.4,,2.3,534,0
175050,"Bagels, plain, unenriched, with calcium propionate (includes onion, poppy, sesame)",baking,275,10.5,1.6,0.22,53.4,,2.3,534,1
175051,"Bagels, plain, unenriched, without calcium propionate(includes onion, poppy, sesame)",baking,275,10.5,1.6,0.22,53.4,,2.3,534,1
167533,"Bagels, wheat",baking,250,10.2,1.53,0,48.89,6.12,4.1,439,1
174092,"Bagels, whole grain white",baking,255,9.3,0,0,54.52,9.3,4.7,372,1
172671,"Biscuits, mixed grain, refrigerated dough",baking,263,6.1,5.6,1.37,47.4,,,670,1
174902,"Biscuits, plain or buttermilk, dry mix",baking,428,8,15.4,3.97,63.4,11.65,2.1,1276,1
172667,"Biscuits, plain or buttermilk, frozen, baked",baking,338,6.2,11.03,1.68,53.87,3.48,1.3,942,1
172668,"Biscuits, plain or buttermilk, refrigerated dough, higher fat",baking,307,6.66,10.58,2.81,46.32,7.4,0.7,977,0
172669,"Biscuits, plain or buttermilk, refrigerated dough, higher fat, baked",baking,324,6.79,11.22,5.51,49.05,8.19,2.8,1002,0
174904,"Biscuits, plain or buttermilk, refrigerated dough, lower fat",baking,270,6.7,7.83,3.14,43.7,7.18,2,828,0
174905,"Biscuits, plain or buttermilk, refrigerated dough, lower fat, baked",baking,319,7.8,9.1,3.65,51.6,8.14,2.3,962,0
174913,"Bread, Italian",baking,259,9.49,2.73,0.54,48.11,4.69,2.1,618,1
174907,"Bread, boston brown, canned",baking,195,5.2,1.5,0.28,43.3,2.42,4.7,631,1
167944,"Bread, cheese",baking,408,10.42,20.83,6.25,44.83,2.08,2.1,750,1
171849,"Bread, cinnamon",baking,253,7.05,5.29,0,44.38,14.11,3.5,388,1
174908,"Bread, cornbread, dry mix, enriched (includes corn muffin mix)",baking,418,7,12.2,3.09,69.5,20.34,6.5,817,1
172815,"Bread, cornbread, dry mix, unenriched (includes corn muffin mix)",baking,418,7,12.2,3.09,69.5,,6.5,1111,1
172672,"Bread, cracked-wheat",baking,260,8.7,3.9,0.92,49.5,,5.5,538,1
174928,"Bread, crumbs, dry, grated, plain",baking,395,13.35,5.3,1.2,71.98,6.2,4.5,732,1
172806,"Bread, crumbs, dry, grated, seasoned",baking,383,14.13,5.48,1.39,68.49,5.74,4.9,2100,1
172673,"Bread, egg",baking,287,9.5,6,1.59,47.8,1.78,2.3,380,1
172674,"Bread, egg, toasted",baking,315,10.5,6.6,1.62,52.6,1.94,2.5,417,1
172675,"Bread, french or vienna (includes sourdough)",baking,272,10.75,2.42,0.53,51.88,4.62,2.2,602,1
174911,"Bread, french or vienna, toasted (includes sourdough)",baking,319,13,2.14,0.5,61.93,3.59,3.1,720,1
174091,"Bread, french or vienna, whole wheat",baking,239,8.33,1.04,0,49.1,0,4.2,375,0
174099,"Bread, gluten-free, white, made with potato extract, rice starch, and rice flour",baking,320,3.13,10.7,0.34,52.83,8.36,3.5,528,1
174100,"Bread, gluten-free, white, made with rice flour, corn starch, and/or tapioca",baking,248,4.31,5.24,0.98,45.78,3.53,4.3,447,1
174101,"Bread, gluten-free, white, made with tapioca starch and brown rice flour",baking,298,5.4,8.02,0.63,51.15,11.3,5.5,515,0
174102,"Bread, gluten-free, whole grain, made with tapioca starch and brown rice flour",baking,309,7.25,9.34,0.27,49.09,9.81,4.9,510,1
168013,"Bread, multi-grain (includes whole-grain)",baking,265,13.36,4.23,0.87,43.34,6.39,7.4,381,1
174914,"Bread, multi-grain, toasted (includes whole-grain)",baking,288,14.52,4.6,0.95,47.11,6.94,8.1,414,1
172676,"Bread, oat bran",baking,236,10.4,4.4,0.7,39.8,7.7,4.5,353,1
172677,"Bread, oat bran, toasted",baking,259,11.4,4.8,0.77,43.7,8.46,4.9,387,1
172678,"Bread, oatmeal",baking,269,8.4,4.4,0.7,48.5,8.14,4,447,1
172679,"Bread, oatmeal, toasted",baking,292,9.2,4.8,0.76,52.7,8.84,4.3,486,1
167935,"Bread, pan dulce, sweet yeast bread",baking,367,9.42,11.58,2.18,56.38,12.5,2.3,228,1
174915,"Bread, pita, white, enriched",baking,275,9.1,1.2,0.17,55.7,1.3,2.2,536,1
172816,"Bread, pita, white, unenriched",baking,275,9.1,1.2,0.17,55.7,,2.2,536,1
174916,"Bread, pita, whole-wheat",baking,262,9.8,1.71,0.21,55.89,2.87,6.1,421,1
167943,"Bread, potato",baking,266,12.5,3.13,0,47.07,9.38,6.3,375,1
167527,"Bread, pound cake type, pan de torta salvadoran",baking,390,7.06,17.45,3.04,51.29,18.1,1.7,390,1
174917,"Bread, protein (includes gluten)",baking,245,12.1,2.2,0.33,43.8,1.44,3,404,1
172809,"Bread, protein, (includes gluten), toasted",baking,270,13.2,2.4,0.36,48.1,1.44,3.3,444,1
174918,"Bread, pumpernickel",baking,250,8.7,3.1,0.44,47.5,0.53,6.5,596,1
172680,"Bread, raisin, enriched",baking,274,7.9,4.4,1.08,52.3,5.68,4.3,347,1
172681,"Bread, raisin, enriched, toasted",baking,297,8.6,4.8,1.18,56.9,6.18,4.7,377,1
172817,"Bread, raisin, unenriched",baking,274,7.9,4.4,1.08,52.3,,4.3,390,1
172682,"Bread, reduced-calorie, oat bran",baking,201,8,3.2,0.45,41.3,3.52,12,459,1
172683,"Bread, reduced-calorie, oat bran, toasted",baking,239,9.5,3.8,0.53,49.2,4.2,14.3,547,1
174919,"Bread, reduced-calorie, oatmeal",baking,210,7.6,3.5,0.6,43.3,,,388,1
174920,"Bread, reduced-calorie, rye",baking,203,9.1,2.9,0.37,40.5,2.29,12,513,1
174921,"Bread, reduced-calorie, wheat",baking,217,13.32,2.92,0.84,42.47,3.71,11.1,332,1
174922,"Bread, reduced-calorie, white",baking,207,8.7,2.5,0.55,44.3,4.76,9.7,479,1
174923,"Bread, rice bran",baking,243,8.9,4.6,0.71,43.5,4.67,4.9,269,1
175044,"Bread, rice bran, toasted",baking,264,9.7,5,0.77,47.3,5.08,5.3,292,1
174078,"Bread, roll, Mexican, bollilo",baking,318,10.65,5.8,1.4,55.77,3.55,2.2,506,1
172684,"Bread, rye",baking,259,8.5,3.3,0.63,48.3,3.85,5.8,603,1
172685,"Bread, rye, toasted",baking,284,9.4,3.6,0.69,53.1,4.23,6.4,664,1
167526,"Bread, salvadoran sweet cheese (quesadilla salvadorena)",baking,374,7.12,17.12,4.61,47.84,24.9,0.7,510,1
174929,"Bread, sticks, plain",baking,412,12,9.5,1.41,68.4,1.26,3,713,1
172692,"Bread, stuffing, cornbread, dry mix",baking,389,10,4.2,0.92,76.7,13.16,14.3,1429,1
174930,"Bread, stuffing, dry mix",baking,386,11,3.4,0.85,76.2,8.27,3.2,1405,1
172686,"Bread, wheat",baking,274,10.67,4.53,0.7,47.54,5.73,4,473,1
171850,"Bread, wheat, sprouted",baking,188,13.16,0,0,33.88,2.63,5.3,474,1
171851,"Bread, wheat, sprouted, toasted",baking,205,14.3,0,0,36.82,2.86,5.7,515,1
172687,"Bread, wheat, toasted",baking,313,12.96,4.27,0.99,55.77,6.42,4.7,601,1
167532,"Bread, white wheat",baking,238,10.66,2.15,0.63,43.91,5,9.2,478,1
174933,"Cake, cherry fudge with chocolate frosting",baking,264,2.4,12.5,5.07,38,32.94,0.5,164,1
172699,"Cake, coffeecake, cheese",baking,339,7,15.2,5.39,44.3,,1,339,1
174936,"Cake, coffeecake, creme-filled with chocolate frosting",baking,331,5,10.8,2.83,53.8,,2,323,1
174937,"Cake, coffeecake, fruit",baking,311,5.2,10.2,2.5,51.5,,2.5,385,1
172701,"Cake, gingerbread, dry mix",baking,437,4.4,13.8,3.46,74.6,46.62,1.7,657,1
167937,"Cake, pound, Bimbo Bakeries USA, Panque Casero, home baked style",baking,418,6.62,21.7,,48.94,28.77,1,357,1
174932,"Cake, pudding-type, carrot, dry mix",baking,415,5.1,9.8,1.47,79.2,,,567,1
174935,"Cake, pudding-type, chocolate, dry mix",baking,391,4.6,8.14,3.5,80.16,39.53,2.3,866,1
172708,"Cake, pudding-type, white, enriched, dry mix",baking,423,3.9,9.5,2.39,80.9,48.95,0.7,665,1
175054,"Cake, pudding-type, white, unenriched, dry mix",baking,423,3.9,9.5,2.34,81,,0.7,665,1
174946,"Cake, pudding-type, yellow, dry mix",baking,423,4,9.8,2.47,80,44.21,0.7,860,1
174942,"Cake, snack cakes, creme-filled, chocolate with frosting",baking,399,3.63,15.93,4.88,60.31,37.76,3.2,332,1
174082,"Cake, snack cakes, creme-filled, chocolate with frosting, low-fat, with added fiber",baking,409,3.71,13,5.57,69.37,33.42,14.9,483,1
174943,"Cake, snack cakes, creme-filled, sponge",baking,374,3.47,11.54,4.14,64.03,37.3,1,470,0
171839,"Cake, snack cakes, not chocolate, with icing or filling, low-fat, with added fiber",baking,412,3.71,11.14,3.71,74.3,29.71,14.9,316,0
172705,"Cake, white, dry mix, special dietary (includes lemon-flavored)",baking,397,3,8.4,1.25,79.6,,,260,1
174947,"Cake, yellow, enriched, dry mix",baking,374,3.7,3.5,1.62,81.92,43.29,1.2,728,1
173244,"Cake, yellow, light, dry mix",baking,404,4.7,5.5,1.37,84.1,,1.3,604,1
175055,"Cake, yellow, unenriched, dry mix",baking,432,4.4,11.6,1.74,78.1,,1.1,657,1
167940,"Cinnamon buns, frosted (includes honey buns)",baking,452,4.45,26.61,12.65,48.6,25.7,1.2,305,1
173256,"Continental Mills, Krusteaz Almond Poppyseed Muffin Mix, Artificially Flavored, dry",baking,418,5.6,10.3,2.1,75.6,40,1.7,590,1
174079,"Cookie, butter or sugar, with chocolate icing or filling",baking,503,4.1,23.5,14.8,68.83,33.8,1.9,301,1
174080,"Cookie, chocolate, with icing or coating",baking,507,4.5,24.2,16.5,67.87,32,2.3,380,1
171835,"Cookie, vanilla with caramel, coconut, and chocolate coating",baking,489,3.5,25.8,17.7,64.1,35.8,4.4,182,1
171836,"Cookie, with peanut butter filling, chocolate-coated",baking,562,8.1,35.3,19.2,52.9,30.9,3.5,371,1
171867,"Cookies, Marie biscuit",baking,406,7.05,10.58,5.29,70.54,21.16,3.5,370,1
168014,"Cookies, animal crackers (includes arrowroot, tea biscuits)",baking,446,6.9,13.8,3.46,74.1,23.3,1.1,335,1
171837,"Cookies, animal, with frosting or icing",baking,509,3,24.1,16.2,70.09,41.1,0.9,257,1
174948,"Cookies, brownies, dry mix, regular",baking,434,4,14.9,2.52,76.6,,,303,1
172731,"Cookies, brownies, dry mix, sugar free",baking,426,2.9,12.5,2.02,80.4,,4.2,83,1
174095,"Cookies, chocolate chip sandwich, with creme filling",baking,425,2.94,17.65,5.88,63.52,38.24,0,279,1
174952,"Cookies, chocolate chip, dry mix",baking,497,4.6,25.2,8.32,66.1,,,290,1
174953,"Cookies, chocolate chip, refrigerated dough",baking,451,3.98,21.33,8.39,61.02,38.04,1.5,321,0
174954,"Cookies, chocolate chip, refrigerated dough, baked",baking,492,4.9,22.6,7.76,68.2,,1.7,232,0
171866,"Cookies, chocolate cream covered biscuit sticks",baking,447,10,22.5,12.58,51.08,25,5,213,1
171841,"Cookies, chocolate sandwich, with creme filling, reduced fat",baking,436,2.94,13.24,2.94,76.17,41.18,2.9,471,1
172718,"Cookies, chocolate sandwich, with creme filling, regular",baking,464,5.21,19.14,5.65,71,40.67,2.9,388,1
172719,"Cookies, chocolate sandwich, with creme filling, regular, chocolate-coated",baking,481,3.6,26.4,7.43,66.4,49.58,5.2,326,0
172733,"Cookies, chocolate sandwich, with creme filling, special dietary",baking,461,4.5,22.1,3.99,68,19.73,4.1,342,0
172720,"Cookies, chocolate sandwich, with extra creme filling",baking,497,4.33,24.52,5.45,68.2,46,2.7,351,0
172714,"Cookies, chocolate wafers",baking,433,6.6,14.2,4.24,72.7,37.43,3.4,580,1
174096,"Cookies, chocolate, made with rice cereal",baking,440,3.23,19.35,11.29,63.26,40.32,1.6,210,1
171847,"Cookies, coconut macaroon",baking,460,3.02,22.55,20.1,61.22,45.16,5.1,241,1
172721,"Cookies, fig bars",baking,348,3.7,7.3,1.12,70.9,46.36,4.6,350,1
172722,"Cookies, fortune",baking,378,4.2,2.7,0.67,84,45.42,1.6,31,1
174951,"Cookies, fudge, cake-type (includes trolley cakes)",baking,349,5,3.7,1.11,78.3,,2.8,192,1
174956,"Cookies, gingersnaps",baking,416,5.6,9.8,2.45,76.9,19.92,2.2,555,1
171857,"Cookies, gluten-free, chocolate sandwich, with creme filling",baking,474,2.19,17.89,7.91,76.03,49,2.5,275,1
171858,"Cookies, gluten-free, chocolate wafer",baking,541,4.06,30.42,15.3,62.82,40.99,1.6,122,1
171859,"Cookies, gluten-free, lemon wafer",baking,515,0,24.18,10.5,74.39,42.31,0,111,1
171860,"Cookies, gluten-free, vanilla sandwich, with creme filling",baking,493,2.66,20.47,7.01,74.61,46.68,0.5,201,1
174958,"Cookies, graham crackers, chocolate-coated",baking,500,4,25.8,17.2,66.78,37.3,2.2,265,1
174957,"Cookies, graham crackers, plain or honey (includes cinnamon)",baking,430,6.69,10.6,1.63,77.66,24.85,3.4,516,1
174083,"Cookies, graham crackers, plain or honey, lowfat",baking,386,5.71,5.71,0,77.96,22.86,5.7,629,0
174959,"Cookies, ladyfingers, with lemon juice and rind",baking,365,10.6,9.1,3.07,59.7,25.39,1,147,1
172821,"Cookies, ladyfingers, without lemon juice and rind",baking,363,10.6,9.1,3.02,59.7,,1,147,1
172723,"Cookies, marshmallow, chocolate-coated (includes marshmallow pies)",baking,421,4,16.9,4.72,67.7,44.8,2,188,1
174097,"Cookies, marshmallow, with rice cereal and chocolate chips",baking,435,4.55,18.18,11.36,63.26,40.91,0,341,1
172724,"Cookies, molasses",baking,430,5.6,12.8,3.21,73.8,17.6,1,459,1
171842,"Cookies, oatmeal sandwich, with creme filling",baking,398,2.61,18.29,5.23,55.62,31.36,2.6,500,1
174960,"Cookies, oatmeal, dry mix",baking,462,6.5,19.2,4.76,67.3,,,473,1
171865,"Cookies, oatmeal, reduced fat",baking,365,4.02,10.04,4.09,64.62,32.14,16.1,562,1
174961,"Cookies, oatmeal, refrigerated dough",baking,424,5.4,18.9,4.75,59.1,,2.5,294,1
174962,"Cookies, oatmeal, refrigerated dough, baked",baking,471,6,21,5.34,65.7,,2.8,327,1
333008,"Cookies, oatmeal, soft, with raisins",baking,430,5.79,14.3,4.78,69.6,,3.3,314,1
174963,"Cookies, oatmeal, with raisins",baking,441,5.86,15.76,5.44,68.95,33.14,3.3,322,1
174965,"Cookies, peanut butter sandwich, regular",baking,478,8.8,21.1,5,65.6,35.44,1.9,368,1
174969,"Cookies, peanut butter sandwich, special dietary",baking,535,10,34,4.94,50.8,,,412,1
172729,"Cookies, peanut butter, refrigerated dough",baking,458,8.2,25,5.79,52.1,,1.1,397,0
172730,"Cookies, peanut butter, refrigerated dough, baked",baking,503,9.1,27.5,6.2,57.3,,1.2,436,0
174966,"Cookies, raisin, soft-type",baking,401,4.1,13.6,3.46,68,47.56,1.2,418,1
174087,"Cookies, shortbread, reduced fat",baking,451,5.37,14,4.69,75.99,21.65,1.3,571,1
174088,"Cookies, sugar wafer, chocolate-covered",baking,526,3.45,27.59,17.24,65.99,51.72,3.4,138,1
174970,"Cookies, sugar wafer, with creme filling, sugar free",baking,531,3.57,28.57,4.26,66.26,0,14.3,71,1
172736,"Cookies, sugar wafers with creme filling, regular",baking,502,3.84,23.24,11.9,70.64,42.95,1.6,103,1
174972,"Cookies, sugar, refrigerated dough",baking,436,4,19.48,4.96,61.22,36.51,0.9,328,1
172735,"Cookies, sugar, refrigerated dough, baked",baking,489,4.7,23.1,5.91,65.6,40.36,0.9,362,1
172737,"Cookies, vanilla sandwich with creme filling",baking,483,4.5,20,2.98,72.1,39.3,1.5,388,1
171868,"Cookies, vanilla sandwich with creme filling, reduced fat",baking,423,4.17,10.42,3.18,78.16,37.5,2.1,354,1
174974,"Cookies, vanilla wafers, higher fat",baking,455,4.9,16.41,4.25,72.6,35.07,1.6,325,1
174973,"Cookies, vanilla wafers, lower fat",baking,441,5,15.2,3.84,73.6,37.5,1.9,388,1
172750,"Cracker, meal",baking,383,9.3,1.7,0.27,80.9,0.33,2.6,16,1
175060,"Crackers, cheese, low sodium",baking,503,10.1,25.3,9.64,58.2,0.28,2.4,458,1
167941,"Crackers, cheese, reduced fat",baking,418,10,11.67,3.33,68.19,0,3.3,1167,1
174975,"Crackers, cheese, regular",baking,489,10.93,22.74,5.29,59.42,4.53,2.3,973,1
167925,"Crackers, cheese, sandwich-type with cheese filling",baking,490,8.92,24.41,4.81,58.76,12.33,1.9,878,1
174976,"Crackers, cheese, sandwich-type with peanut butter filling",baking,496,12.41,25.12,4.41,56.74,6.98,3.4,829,1
174084,"Crackers, cheese, whole grain",baking,412,9.62,16.03,3.21,57.29,0,6.4,706,1
167530,"Crackers, cream, Gamesa Sabrosas",baking,484,7.01,20.37,5.36,64.55,9.37,2.4,1148,1
167531,"Crackers, cream, La Moderna Rikis Cream Crackers",baking,464,7.19,19.5,2.63,64.88,10.41,2.4,752,1
172739,"Crackers, crispbread, rye",baking,366,7.9,1.3,0.15,82.2,1.07,16.5,410,1
174098,"Crackers, flavored, fish-shaped",baking,463,10.16,17.71,2.06,65.67,1.18,3.1,970,1
174104,"Crackers, gluten-free, multi-seeded and multigrain",baking,453,11.25,15.84,2.07,66.3,0.86,10.2,438,1
174103,"Crackers, gluten-free, multigrain and vegetable, made with corn starch and white rice flour",baking,456,2.5,15.41,5.71,76.94,3.9,3,890,1
172741,"Crackers, matzo, egg",baking,391,12.3,2.1,0.55,78.6,,2.8,21,1
172812,"Crackers, matzo, egg and onion",baking,391,10,3.9,0.94,77.1,,5,285,1
172740,"Crackers, matzo, plain",baking,395,10,1.4,0.23,83.7,0.29,3,0,1
172742,"Crackers, matzo, whole-wheat",baking,351,13.1,1.5,0.24,78.9,,11.8,2,1
174977,"Crackers, melba toast, plain",baking,390,12.1,3.2,0.45,76.6,0.94,6.3,598,1
172822,"Crackers, melba toast, plain, without salt",baking,390,12.1,3.2,0.45,76.6,,6.3,19,1
174978,"Crackers, melba toast, rye (includes pumpernickel)",baking,389,11.6,3.4,0.45,77.3,,8,899,0
174979,"Crackers, melba toast, wheat",baking,374,12.9,2.3,0.34,76.4,,7.4,837,0
174980,"Crackers, milk",baking,446,7.6,13.77,2.91,71.73,10.32,3.4,687,1
171838,"Crackers, multigrain",baking,482,7.1,20.4,3.3,67.6,12,3.5,883,1
174981,"Crackers, rusk toast",baking,407,13.5,7.2,1.38,72.3,,,253,1
172743,"Crackers, rye, sandwich-type with cheese filling",baking,481,9.2,22.3,5.99,60.8,,3.6,1044,1
172744,"Crackers, rye, wafers, plain",baking,334,9.6,0.9,0.11,80.4,1.01,22.9,557,1
172745,"Crackers, rye, wafers, seasoned",baking,381,9,9.2,1.29,73.8,,20.9,887,1
172746,"Crackers, saltines (includes oyster, soda, soup)",baking,418,9.46,8.64,1.65,74.05,1.29,2.8,941,1
175068,"Crackers, saltines, fat-free, low-sodium",baking,393,10.5,1.6,0.24,82.3,0.38,2.7,849,1
175056,"Crackers, saltines, low salt (includes oyster, soda, soup)",baking,421,9.5,8.85,2,74.34,2.22,2.9,198,1
175057,"Crackers, saltines, unsalted tops (includes oyster, soda, soup)",baking,434,9.2,11.8,2.93,71.5,,3,766,1
167942,"Crackers, saltines, whole wheat (includes multi-grain)",baking,398,7.14,10.71,0,68.25,0,6.7,1214,1
171848,"Crackers, sandwich-type, peanut butter filled, reduced fat",baking,437,8.33,16.67,2.78,63.49,11.11,2.8,639,1
167529,"Crackers, snack, Goya Crackers",baking,433,14.25,13.35,6.32,64.35,2.35,3.8,665,1
174982,"Crackers, standard snack-type, regular",baking,510,6.64,26.43,5.56,61.3,8.18,2.3,726,1
175058,"Crackers, standard snack-type, regular, low salt",baking,502,7.4,25.3,3.78,61,1.79,1.6,216,1
174983,"Crackers, standard snack-type, sandwich, with cheese filling",baking,477,9.3,21.1,6.13,61.7,3.18,1.9,978,0
174984,"Crackers, standard snack-type, sandwich, with peanut butter filling",baking,494,11.47,24.54,4.8,58.38,10.5,2.3,801,0
171846,"Crackers, standard snack-type, with whole wheat",baking,463,7.29,17.84,4.35,68.37,10.43,4.9,748,0
171854,"Crackers, toast thins, low sodium",baking,442,6.45,16.13,3.23,67.66,12.9,9.7,177,1
171856,"Crackers, water biscuits",baking,384,7.14,7.14,0,72.81,0,7.1,571,1
175059,"Crackers, wheat, low salt",baking,473,8.6,20.6,5.18,64.9,13.04,4.5,190,1
167934,"Crackers, wheat, reduced fat",baking,444,9.34,13.37,2.11,71.52,15.01,3.4,776,1
174985,"Crackers, wheat, regular",baking,455,7.3,16.4,3.21,70.73,15.48,6.9,699,1
172747,"Crackers, wheat, sandwich, with cheese filling",baking,497,9.8,25,4.13,58.2,,3.1,839,1
172748,"Crackers, wheat, sandwich, with peanut butter filling",baking,495,13.5,26.7,4.6,53.8,,4.4,807,1
171855,"Crackers, whole grain, sandwich-type, with peanut butter filling",baking,465,14.12,21.18,4.53,54.59,9.41,9.4,635,1
172749,"Crackers, whole-wheat",baking,427,10.58,14.13,2.06,69.55,1.19,10.3,800,1
172823,"Crackers, whole-wheat, low salt",baking,443,8.8,17.2,3.39,68.6,0.37,10.5,186,1
167933,"Crackers, whole-wheat, reduced fat",baking,416,11.34,7.59,1.07,75.52,1.22,10.9,745,1
167534,"Cream puff, eclair, custard or cream filled, iced",baking,334,4.41,18.52,7.06,37.43,22.05,0.9,265,1
174988,"Croissants, apple",baking,254,7.4,8.7,4.99,37.1,,2.5,274,1
174987,"Croissants, butter",baking,406,8.2,21,11.66,45.8,11.26,2.6,384,1
174989,"Croissants, cheese",baking,414,9.2,20.9,10.63,47,11.35,2.6,361,1
172751,"Croutons, plain",baking,407,11.9,6.6,1.51,73.5,,5.1,698,1
172752,"Croutons, seasoned",baking,465,10.8,18.3,5.25,63.5,4.41,5,1333,1
167591,"Crunchmaster, Multi-Grain Crisps, Snack Crackers, Gluten-Free",baking,456,10.91,15.92,2.07,67.18,0.8,7.5,370,1
172754,"Danish pastry, cheese",baking,374,8,21.9,6.79,37.2,6.95,1,417,1
172753,"Danish pastry, cinnamon, enriched",baking,403,7,22.4,5.68,44.6,19.78,1.3,414,1
172824,"Danish pastry, cinnamon, unenriched",baking,403,7,22.4,5.68,44.6,,1.2,371,1
172755,"Danish pastry, fruit, enriched (includes apple, cinnamon, raisin, lemon, raspberry, strawberry)",baking,371,5.4,18.5,4.86,47.8,27.53,1.9,445,1
172825,"Danish pastry, fruit, unenriched (includes apple, cinnamon, raisin, strawberry)",baking,371,5.4,18.5,2.83,47.8,,1.9,354,1
172827,"Danish pastry, lemon, unenriched",baking,371,5.4,18.5,2.83,47.8,,1.9,354,1
175061,"Danish pastry, raspberry, unenriched",baking,371,5.4,18.5,2.83,47.8,,1.9,354,1
174993,"Doughnuts, cake-type, chocolate, sugared or glazed",baking,417,4.5,19.9,5.13,57.4,31.92,2.2,215,1
174990,"Doughnuts, cake-type, plain (includes unsugared, old-fashioned)",baking,434,5.31,24.93,11.11,47.06,18.15,1.7,477,1
174991,"Doughnuts, cake-type, plain, chocolate-coated or frosted",baking,452,4.93,25.25,13.47,51.33,26.65,1.9,326,1
174992,"Doughnuts, cake-type, plain, sugared or glazed",baking,426,5.2,22.9,5.93,50.8,,1.5,402,0
172756,"Doughnuts, french crullers, glazed",baking,412,3.1,18.3,4.67,59.5,35.11,1.2,345,1
172758,"Doughnuts, yeast-leavened, glazed, enriched (includes honey buns)",baking,421,6.14,22.7,9.45,47.93,22.75,2.1,316,1
175062,"Doughnuts, yeast-leavened, glazed, unenriched (includes honey buns)",baking,403,6.4,22.8,5.81,44.3,,1.2,342,1
172757,"Doughnuts, yeast-leavened, with creme filling",baking,361,6.4,24.5,5.43,30,14.55,0.8,309,1
172759,"Doughnuts, yeast-leavened, with jelly filling",baking,340,5.9,18.7,4.84,39,21.1,0.9,455,1
175063,"English muffins, plain, enriched, without calcium propionate(includes sourdough)",baking,235,7.7,1.8,0.26,46,,2.7,464,1
172828,"English muffins, plain, unenriched, with calcium propionate (includes sourdough)",baking,235,7.7,1.8,0.26,46,,2.7,464,1
173238,"English muffins, plain, unenriched, without calcium propionate (includes sourdough)",baking,235,7.7,1.8,0.26,46,,2.7,464,0
174093,"English muffins, whole grain white",baking,245,7.02,1.75,0,50.17,1.75,3.5,386,1
167945,"Focaccia, Italian flatbread, plain",baking,249,8.77,7.89,0.88,35.82,1.75,1.8,561,1
172763,"French toast, frozen, ready-to-heat",baking,213,7.4,6.1,1.53,32.1,,1.1,495,1
167939,"Garlic bread, frozen",baking,350,8.36,16.61,5.28,41.72,3.69,2.5,544,1
173254,"George Weston Bakeries, Brownberry Sage and Onion Stuffing Mix, dry",baking,390,13.3,5.1,0.9,72.7,,5.4,1680,1
167515,"George Weston Bakeries, Thomas English Muffins",baking,232,8,1.8,0.31,46,,,345,1
167592,"Glutino, Gluten Free Cookies, Chocolate Vanilla Creme",baking,474,2.19,17.89,7.91,76.03,49,2.5,275,1
167593,"Glutino, Gluten Free Cookies, Vanilla Creme",baking,487,2.19,18.79,8.09,77.34,49.43,0,189,1
168002,"Glutino, Gluten Free Wafers, Lemon Flavored",baking,515,0,24.18,10.5,74.39,42.31,0,111,0
168003,"Glutino, Gluten Free Wafers, Milk Chocolate",baking,541,4.06,30.42,15.3,62.82,40.99,1.6,122,0
167922,"Heinz, Weight Watcher, Chocolate Eclair, frozen",baking,241,4.4,6.9,1.4,40.3,16.8,2.1,300,1
175000,"Ice cream cones, cake or wafer-type",baking,417,8.1,6.9,1.22,79,6,3,256,1
175001,"Ice cream cones, sugar, rolled-type",baking,402,7.9,3.8,0.57,84.1,25.66,1.7,298,1
167923,"Interstate Brands Corp, Wonder Hamburger Rolls",baking,273,8.07,4.15,1.01,50.84,11.06,2.6,488,1
173255,"Keebler, Keebler Chocolate Graham SELECTS",baking,465,7.1,16.6,3.15,71.8,26.5,,357,1
167936,"Keikitos (muffins), Latino bakery item",baking,467,6.81,25.24,,53.16,25.81,1.2,515,1
167514,"Kraft Foods, Shake N Bake Original Recipe, Coating for Pork, dry",baking,377,6.1,3.7,,79.8,,,2182,1
175079,"Kraft, Stove Top Stuffing Mix Chicken Flavor",baking,381,12.6,4.1,0.8,73.1,10.1,2.5,1532,1
172803,"Leavening agents, baking powder, double-acting, sodium aluminum sulfate",baking,53,0,0,0,27.7,0,0.2,10600,1
172804,"Leavening agents, baking powder, double-acting, straight phosphate",baking,51,0.1,0,0,24.1,0,0.2,7893,1
