174645,"Cereals ready-to-eat, MALT-O-MEAL, Apple ZINGS",grains-cereals,390,4.51,2.71,0.73,87.3,44.61,2.3,454,1
172982,"Cereals ready-to-eat, MALT-O-MEAL, BERRY COLOSSAL CRUNCH",grains-cereals,396,4.19,4.17,1.21,86.55,41.66,1.8,633,1
172997,"Cereals ready-to-eat, MALT-O-MEAL, Blueberry MUFFIN TOPS Cereal",grains-cereals,443,4.9,11.48,1.66,79.91,35.36,4.7,462,0
174664,"Cereals ready-to-eat, MALT-O-MEAL, CHOCOLATE MARSHMALLOW MATEYS",grains-cereals,392,3.5,3.67,1.6,88.18,55.45,2.5,368,0
174646,"Cereals ready-to-eat, MALT-O-MEAL, CINNAMON TOASTERS",grains-cereals,425,3.32,12.06,1.85,78.33,32.86,5,473,0
174619,"Cereals ready-to-eat, MALT-O-MEAL, COCO-ROOS",grains-cereals,389,3.41,4.61,2.57,86.75,48.11,3.3,350,0
174631,"Cereals ready-to-eat, MALT-O-MEAL, COLOSSAL CRUNCH",grains-cereals,401,3.64,5.28,2.24,81.59,42.5,1.7,806,0
173895,"Cereals ready-to-eat, MALT-O-MEAL, CORN BURSTS",grains-cereals,385,3.32,0.35,0.09,90.59,46.88,1.9,855,0
174647,"Cereals ready-to-eat, MALT-O-MEAL, Cocoa DYNO-BITES",grains-cereals,397,4.15,3.43,2.58,87.93,43.15,1.1,534,0
172983,"Cereals ready-to-eat, MALT-O-MEAL, Crispy Rice",grains-cereals,346,6.07,1.12,0,86.4,7.82,0.4,924,0
172990,"Cereals ready-to-eat, MALT-O-MEAL, Frosted Flakes",grains-cereals,389,4.25,0.87,0.11,90.2,39.27,1.2,451,0
173000,"Cereals ready-to-eat, MALT-O-MEAL, Frosted Mini SPOONERS",grains-cereals,354,9.09,1.94,0.23,81.81,20,10.9,18,0
173001,"Cereals ready-to-eat, MALT-O-MEAL, Fruity DYNO-BITES",grains-cereals,404,3.9,3.15,0.64,90.1,42.6,1,630,0
174643,"Cereals ready-to-eat, MALT-O-MEAL, GOLDEN PUFFS",grains-cereals,370,5.77,0.89,0.16,89.72,51.34,2.6,204,0
172995,"Cereals ready-to-eat, MALT-O-MEAL, HONEY GRAHAM SQUARES",grains-cereals,398,4.46,9.97,1.5,74.68,32.7,4.4,838,0
174642,"Cereals ready-to-eat, MALT-O-MEAL, Honey BUZZERS",grains-cereals,379,3.45,1.72,0.59,89.66,37.93,3.4,759,0
171681,"Cereals ready-to-eat, MALT-O-MEAL, Honey Nut SCOOTERS",grains-cereals,387,8.59,4.51,0.63,79.62,29.97,6.3,695,0
173909,"Cereals ready-to-eat, MALT-O-MEAL, MARSHMALLOW MATEYS",grains-cereals,387,6.94,3.53,0.72,82.77,40.91,4.9,667,0
171679,"Cereals ready-to-eat, MALT-O-MEAL, OAT BLENDERS with honey",grains-cereals,396,6.78,4.17,0.5,84.94,21.62,5,515,0
171680,"Cereals ready-to-eat, MALT-O-MEAL, OAT BLENDERS with honey & almonds",grains-cereals,379,7.8,4.88,0.62,77.26,20.26,6.1,453,0
172996,"Cereals ready-to-eat, MALT-O-MEAL, Raisin Bran Cereal",grains-cereals,342,7.63,1.87,0.42,80.37,33.04,10.2,466,0
172984,"Cereals ready-to-eat, MALT-O-MEAL, TOOTIE FRUITIES",grains-cereals,391,4.69,3.2,0.69,85.94,45.31,2.2,453,0
174644,"Cereals ready-to-eat, MOM'S BEST, Honey Nut TOASTY O'S",grains-cereals,388,8.6,4.51,0.55,79.84,30.17,6.3,683,1
173927,"Cereals ready-to-eat, MOM'S BEST, Sweetened WHEAT-FULS",grains-cereals,373,8.18,1.83,0,80.91,20.29,10,14,1
173017,"Cereals ready-to-eat, NATURE'S PATH, Organic FLAX PLUS flakes",grains-cereals,350,11.91,5.46,0.62,75.27,12.25,16.6,458,1
174654,"Cereals ready-to-eat, NATURE'S PATH, Organic FLAX PLUS, Pumpkin Granola",grains-cereals,467,11.23,18.33,2.8,66.1,18.17,8.4,74,1
167725,"Cereals ready-to-eat, OAT BRAN FLAKES, HEALTH VALLEY",grains-cereals,380,10,3,1,78,22,8,380,1
173888,"Cereals ready-to-eat, POST Bran Flakes",grains-cereals,328,9.9,2.1,0.4,80.5,18.6,18.3,540,1
169870,"Cereals ready-to-eat, POST GREAT GRAINS Banana Nut Crunch",grains-cereals,390,9.8,8.8,1.1,70.9,17.5,11.2,238,1
173005,"Cereals ready-to-eat, POST GREAT GRAINS Cranberry Almond Crunch",grains-cereals,384,8.9,5.9,0.8,76.6,25.5,11.1,214,0
173020,"Cereals ready-to-eat, POST HONEY BUNCHES OF OATS with cinnamon bunches",grains-cereals,400,7.1,5,0.6,82.8,20.4,5.8,464,0
171650,"Cereals ready-to-eat, POST Raisin Bran Cereal",grains-cereals,324,7.6,1.6,0.3,78.9,32.9,13.7,382,0
173919,"Cereals ready-to-eat, POST SELECTS Blueberry Morning",grains-cereals,395,6.5,5.3,0.6,81.6,29.2,4.7,341,0
174653,"Cereals ready-to-eat, POST SELECTS Maple Pecan Crunch",grains-cereals,413,8.5,8.7,1,77.4,22.5,7.4,239,0
171641,"Cereals ready-to-eat, POST, ALPHA-BITS",grains-cereals,389,10,4.6,1.1,80.3,21,7.1,592,0
173885,"Cereals ready-to-eat, POST, COCOA PEBBLES",grains-cereals,397,4.8,4.1,3.6,85.7,35.8,1.6,594,0
171645,"Cereals ready-to-eat, POST, FRUITY PEBBLES",grains-cereals,402,4.62,4.02,3.6,86.1,34.28,0.8,531,0
171652,"Cereals ready-to-eat, POST, GOLDEN CRISP",grains-cereals,380,5.5,1.7,0.2,90.1,53.6,5,95,0
171647,"Cereals ready-to-eat, POST, GRAPE-NUTS Cereal",grains-cereals,361,11.22,1.81,0.34,80.49,8.86,13,465,0
171648,"Cereals ready-to-eat, POST, GRAPE-NUTS Flakes",grains-cereals,376,9.4,3.7,0.5,82,15.2,10.2,470,0
169862,"Cereals ready-to-eat, POST, GREAT GRAINS Crunchy Pecan Cereal",grains-cereals,403,9,10.5,1,73,15.4,9.7,287,0
169041,"Cereals ready-to-eat, POST, GREAT GRAINS, Raisin, Date & Pecan",grains-cereals,378,7.9,7.1,0.8,74.3,24.1,9.3,247,0
173015,"Cereals ready-to-eat, POST, HONEY BUNCHES OF OATS with vanilla bunches",grains-cereals,394,7.9,5.1,0.6,81.8,20.7,7.8,267,0
168138,"Cereals ready-to-eat, POST, HONEY BUNCHES OF OATS, honey roasted",grains-cereals,401,7.12,5.46,0.64,81.19,19.79,4.2,454,0
174663,"Cereals ready-to-eat, POST, HONEY BUNCHES OF OATS, pecan bunches",grains-cereals,399,7,5.4,0.7,82,21.9,5.2,483,0
169859,"Cereals ready-to-eat, POST, HONEY BUNCHES OF OATS, with almonds",grains-cereals,409,7.7,7.3,0.8,79.6,20,5.5,417,0
173019,"Cereals ready-to-eat, POST, HONEY BUNCHES OF OATS, with real strawberries",grains-cereals,399,6.7,4.9,0.6,83.3,24,5.4,410,0
173894,"Cereals ready-to-eat, POST, Honey Nut Shredded Wheat",grains-cereals,373,8.5,2.9,0.4,83.6,20.7,10.7,102,0
173889,"Cereals ready-to-eat, POST, Honeycomb Cereal",grains-cereals,394,6.01,2.93,1.29,86.63,31.51,3.2,553,0
167715,"Cereals ready-to-eat, POST, Shredded Wheat n' Bran, spoon-size",grains-cereals,339,10.93,2.06,0.43,80.65,0.75,14.7,0,0
173918,"Cereals ready-to-eat, POST, Shredded Wheat, lightly frosted, spoon-size",grains-cereals,352,7.8,1.9,0.3,83.8,22.3,9.6,19,0
173910,"Cereals ready-to-eat, POST, Shredded Wheat, original big biscuit",grains-cereals,337,11.37,2.01,0.41,78.96,0.94,12.4,2,0
173911,"Cereals ready-to-eat, POST, Shredded Wheat, original spoon-size",grains-cereals,351,11.8,2.1,0.4,81.4,0.9,12.4,2,0
174628,"Cereals ready-to-eat, Post, Waffle Crisp",grains-cereals,390,6.6,5,0.9,83,34.7,4.4,596,0
173014,"Cereals ready-to-eat, QUAKER Oatmeal Squares, Golden Maple",grains-cereals,380,11.3,4.83,0.87,78.04,16.82,8.3,347,1
173921,"Cereals ready-to-eat, QUAKER WHOLE HEARTS oat cereal",grains-cereals,376,7.63,5.61,0.84,80.1,21.53,9.1,554,1
173892,"Cereals ready-to-eat, QUAKER, 100% Natural Granola, Oats, Wheat and Honey",grains-cereals,421,10.55,11.62,1.24,73.65,20.34,10.2,50,0
171642,"Cereals ready-to-eat, QUAKER, CAP'N CRUNCH",grains-cereals,398,4.39,5.12,3.35,85.51,44.32,2.5,754,0
171643,"Cereals ready-to-eat, QUAKER, CAP'N CRUNCH with CRUNCHBERRIES",grains-cereals,397,4.45,4.83,3.08,85.93,44.2,2.6,725,0
174657,"Cereals ready-to-eat, QUAKER, CAP'N CRUNCH'S Halloween Crunch",grains-cereals,402,4.41,5.66,3.12,85.14,43.82,2.5,719,0
171644,"Cereals ready-to-eat, QUAKER, CAP'N CRUNCH'S PEANUT BUTTER CRUNCH",grains-cereals,417,7.1,9.23,3.92,78.65,33.36,2.7,742,0
173013,"Cereals ready-to-eat, QUAKER, Cap'n Crunch's OOPS! All Berries Cereal",grains-cereals,395,4.6,3.99,2.29,87.1,44.18,2.6,637,0
174652,"Cereals ready-to-eat, QUAKER, Christmas Crunch",grains-cereals,397,4.44,4.83,3.08,85.92,44.31,2.6,724,0
174621,"Cereals ready-to-eat, QUAKER, HONEY GRAHAM OH!S",grains-cereals,412,3.92,7.63,5.71,83.65,43.23,2.1,679,0
173890,"Cereals ready-to-eat, QUAKER, KING VITAMAN",grains-cereals,381,6.41,3.44,1.58,83.85,20.27,3.4,825,0
172976,"Cereals ready-to-eat, QUAKER, Low Fat 100% Natural Granola with Raisins",grains-cereals,388,8.42,5.52,0.97,80.57,25.65,9.6,234,0
174634,"Cereals ready-to-eat, QUAKER, MOTHER'S COCOA BUMPERS",grains-cereals,382,4.21,1.61,0.31,89.91,43.12,2.7,452,0
174632,"Cereals ready-to-eat, QUAKER, MOTHER'S Cinnamon Oat Crunch",grains-cereals,382,10.6,4.56,0.82,79.79,25.37,8.1,275,0
174633,"Cereals ready-to-eat, QUAKER, MOTHER'S GRAHAM BUMPERS",grains-cereals,379,4.55,1.45,0.28,88.89,44.33,2.6,758,0
172985,"Cereals ready-to-eat, QUAKER, MOTHER'S PEANUT BUTTER BUMPERS Cereal",grains-cereals,407,7.62,7.33,1.45,79.68,29.29,2.5,774,0
172986,"Cereals ready-to-eat, QUAKER, MOTHER'S Toasted Oat Bran cereal",grains-cereals,372,11.45,5.04,0.89,75.41,15.57,8.6,653,0
174659,"Cereals ready-to-eat, QUAKER, Maple Brown Sugar LIFE Cereal",grains-cereals,373,9.17,4.06,0.77,78.86,24.9,6.3,477,0
174658,"Cereals ready-to-eat, QUAKER, Natural Granola Apple Cranberry Almond",grains-cereals,418,9.21,11.06,1.13,74.73,27.43,9.9,47,0
174622,"Cereals ready-to-eat, QUAKER, Oatmeal Squares",grains-cereals,379,11.38,4.83,0.87,77.77,16.69,8.3,347,0
174623,"Cereals ready-to-eat, QUAKER, Oatmeal Squares, cinnamon",grains-cereals,379,11.23,4.88,0.88,78.09,16.67,8.7,344,0
172975,"Cereals ready-to-eat, QUAKER, QUAKER 100% Natural Granola with Oats, Wheat, Honey, and Raisins",grains-cereals,412,9.66,10.38,1.12,74.67,24.63,9.4,54,0
173886,"Cereals ready-to-eat, QUAKER, QUAKER CRUNCHY BRAN",grains-cereals,331,6.37,4.06,2.03,83.68,20.66,15.3,759,0
173007,"Cereals ready-to-eat, QUAKER, QUAKER Honey Graham LIFE Cereal",grains-cereals,373,9.33,4.14,0.77,78.56,23.12,6.3,488,0
174620,"Cereals ready-to-eat, QUAKER, QUAKER OAT CINNAMON LIFE",grains-cereals,374,9.14,4.1,0.77,79.02,25.18,6.3,463,0
173891,"Cereals ready-to-eat, QUAKER, QUAKER OAT LIFE, plain",grains-cereals,374,9.98,4.43,0.83,77.74,19.43,6.6,501,0
171651,"Cereals ready-to-eat, QUAKER, QUAKER Puffed Rice",grains-cereals,383,7.01,0.9,0.33,87.78,0,1.4,5,0
171669,"Cereals ready-to-eat, QUAKER, QUAKER Puffed Wheat",grains-cereals,366,16.26,2.15,0.41,76.39,1.37,9.4,5,0
171649,"Cereals ready-to-eat, QUAKER, SWEET CRUNCH/QUISP",grains-cereals,406,4.51,6.08,4.44,85.03,43.36,2.3,740,0
172987,"Cereals ready-to-eat, QUAKER, Shredded Wheat, bagged cereal",grains-cereals,348,11.24,2.01,0.41,81.01,0.81,11.8,4,0
172974,"Cereals ready-to-eat, QUAKER, Toasted Multigrain Crisps",grains-cereals,372,12.38,5.11,0.91,74.9,16.34,10.2,365,0
173887,"Cereals ready-to-eat, RALSTON CRISP RICE",grains-cereals,383,6.69,1.26,0.36,86.22,12.12,0.7,545,1
173003,"Cereals ready-to-eat, RALSTON Corn Biscuits",grains-cereals,376,5.83,1.05,0.19,85.79,9.51,2.6,767,1
174648,"Cereals ready-to-eat, RALSTON Corn Flakes",grains-cereals,384,5.9,0.91,0.23,88.01,7.84,2.7,571,0
174649,"Cereals ready-to-eat, RALSTON Crispy Hexagons",grains-cereals,379,5.94,0.95,0.26,86.78,13.79,1.5,517,0
173002,"Cereals ready-to-eat, RALSTON Enriched Wheat Bran flakes",grains-cereals,390,10.21,3.36,0.43,79.77,17.17,16.9,586,0
173893,"Cereals ready-to-eat, RALSTON TASTEEOS",grains-cereals,395,10.71,5.36,0.93,75.96,3.57,10.7,571,0
171653,"Cereals ready-to-eat, SUN COUNTRY, KRETSCHMER Honey Crunch Wheat Germ",grains-cereals,372,26.55,7.78,1.36,58.11,21.43,10.2,11,1
174635,"Cereals ready-to-eat, SUN COUNTRY, KRETSCHMER Toasted Wheat Bran",grains-cereals,200,17.56,5.16,0.77,59.51,,41.3,6,1
172988,"Cereals ready-to-eat, SUN COUNTRY, KRETSCHMER Wheat Germ, Regular",grains-cereals,366,31.43,9.56,1.66,49.38,7.14,11.9,6,0
174639,"Cereals ready-to-eat, UNCLE SAM CEREAL",grains-cereals,346,15.98,11.6,0.95,65.78,1.56,20.3,206,1
169040,"Cereals ready-to-eat, WEETABIX whole grain cereal",grains-cereals,371,11.43,2.86,0.48,81.5,5.71,11.4,371,1
172973,"Cereals ready-to-eat, chocolate-flavored frosted puffed corn",grains-cereals,405,3.34,3.5,0.96,87.2,43.7,3.8,534,1
169039,"Cereals ready-to-eat, frosted oat cereal with marshmallows",grains-cereals,400,7.1,3.33,0.62,84.7,36.13,4.3,533,1
171646,"Cereals ready-to-eat, granola, homemade",grains-cereals,489,13.67,24.31,3.96,53.88,19.8,8.9,26,1
173912,"Cereals ready-to-eat, rice, puffed, fortified",grains-cereals,402,6.3,0.5,0.13,89.8,,1.7,3,1
169077,"Cereals ready-to-eat, wheat and bran, presweetened with nuts and fruits",grains-cereals,385,7.1,5.6,0.8,76.2,23.6,9.7,245,1
173896,"Cereals ready-to-eat, wheat germ, toasted, plain",grains-cereals,382,29.1,10.7,1.83,49.6,7.8,15.1,4,1
173913,"Cereals ready-to-eat, wheat, puffed, fortified",grains-cereals,364,14.7,1.2,0.2,79.6,,4.4,4,0
173914,"Cereals, CREAM OF RICE, cooked with water, with salt",grains-cereals,52,0.9,0.1,0.02,11.5,0.04,0.1,173,1
173900,"Cereals, CREAM OF RICE, dry",grains-cereals,370,6.3,0.5,0.14,82.4,0.3,0.7,6,1
173012,"Cereals, CREAM OF WHEAT, 1 minute cook time, cooked with water, microwaved, without salt",grains-cereals,55,1.95,0.37,0.09,10.67,2.98,1.5,4,0
173011,"Cereals, CREAM OF WHEAT, 1 minute cook time, cooked with water, stove-top, without salt",grains-cereals,56,1.65,0.42,0.11,11.16,0.07,0.4,4,0
173010,"Cereals, CREAM OF WHEAT, 1 minute cook time, dry",grains-cereals,359,11.77,1.47,0.3,72.63,0.51,4.4,7,0
173009,"Cereals, CREAM OF WHEAT, 2 1/2 minute cook time, cooked with water, microwaved, without salt",grains-cereals,52,1.88,0.37,0.1,10.1,0.34,0.7,45,0
173008,"Cereals, CREAM OF WHEAT, 2 1/2 minute cook time, cooked with water, stove-top, without salt",grains-cereals,56,1.44,0.2,0.05,11.74,0.07,0.7,34,0
174655,"Cereals, CREAM OF WHEAT, 2 1/2 minute cook time, dry",grains-cereals,355,11.61,1.41,0.25,71.79,0.47,4.4,328,0
171660,"Cereals, CREAM OF WHEAT, instant, dry",grains-cereals,366,10.6,1.4,0.22,75.5,0.4,3.3,571,0
173915,"Cereals, CREAM OF WHEAT, regular (10 minute), cooked with water, with salt",grains-cereals,50,1.46,0.21,0.03,10.66,0.03,0.5,129,0
171657,"Cereals, CREAM OF WHEAT, regular (10 minute), cooked with water, without salt",grains-cereals,50,1.44,0.21,0.03,10.52,0.03,0.5,6,0
173901,"Cereals, CREAM OF WHEAT, regular, 10 minute cooking, dry",grains-cereals,370,10.5,1.5,0.24,76.5,0.2,3.8,7,0
172998,"Cereals, MALT-O-MEAL, Farina Hot Wheat Cereal, dry",grains-cereals,365,10.48,0.49,0.07,77.2,0.7,2.9,3,1
172999,"Cereals, MALT-O-MEAL, Maple & Brown Sugar Hot Wheat Cereal, dry",grains-cereals,368,8.82,0.47,0.09,80.52,28,1.8,5,1
171674,"Cereals, MALT-O-MEAL, chocolate, dry",grains-cereals,363,10.6,0.82,0.31,79.55,16.63,2.8,10,1
173903,"Cereals, MALT-O-MEAL, original, plain, dry",grains-cereals,365,11.8,0.7,0.08,77.25,0,2.1,0,1
172993,"Cereals, QUAKER, Instant Grits Product with American Cheese Flavor, dry",grains-cereals,360,8.8,4.67,1.08,74.18,2.02,4.3,1518,1
172977,"Cereals, QUAKER, Instant Grits, Butter flavor, dry",grains-cereals,369,8.12,5.64,2.58,74.83,0.88,4.7,1197,1
173899,"Cereals, QUAKER, Instant Grits, Country Bacon flavor, dry",grains-cereals,340,9.93,1.73,0.24,75.39,0.38,5.1,1523,0
172994,"Cereals, QUAKER, Instant Grits, Ham 'n' Cheese flavor, dry",grains-cereals,355,10.73,4.68,1.06,71.08,2.69,4.2,1930,0
172992,"Cereals, QUAKER, Instant Grits, Redeye Gravy & Country Ham flavor, dry",grains-cereals,342,9.83,1.58,0.23,75.86,0.71,4.6,1805,0
174660,"Cereals, QUAKER, Instant Oatmeal Organic, Regular",grains-cereals,367,16,6.3,1.11,67,1,9.8,4,0
174662,"Cereals, QUAKER, Instant Oatmeal, Apple and Cinnamon, reduced sugar",grains-cereals,358,10.29,5.64,1.03,72.17,17.78,9.7,535,0
174638,"Cereals, QUAKER, Instant Oatmeal, Banana Bread, dry",grains-cereals,368,8.97,4.85,0.9,75.7,29.45,6.7,700,0
173016,"Cereals, QUAKER, Instant Oatmeal, Cinnamon Spice, reduced sugar",grains-cereals,358,11.26,6.11,1.16,69.45,11.91,8.8,760,0
171682,"Cereals, QUAKER, Instant Oatmeal, Cinnamon Swirl, high fiber",grains-cereals,366,8.79,4.8,0.93,75.67,14.7,22.3,473,0
174636,"Cereals, QUAKER, Instant Oatmeal, Cinnamon-Spice, dry",grains-cereals,369,10.39,5.1,0.81,74.52,21.14,8.2,416,0
174637,"Cereals, QUAKER, Instant Oatmeal, DINOSAUR EGGS, Brown Sugar, dry",grains-cereals,384,8.69,7.59,2.42,73.68,28.91,6.4,500,0
172991,"Cereals, QUAKER, Instant Oatmeal, Raisin and Spice, dry",grains-cereals,360,9.11,4,0.61,75.68,35.65,5.8,440,0
171663,"Cereals, QUAKER, Instant Oatmeal, apples and cinnamon, dry",grains-cereals,366,8.62,4.61,0.88,76.74,28.87,8.3,454,0
174624,"Cereals, QUAKER, Instant Oatmeal, fruit and cream variety, dry",grains-cereals,379,8.3,6.37,1.31,75.42,31.27,6,499,0
174661,"Cereals, QUAKER, Instant Oatmeal, fruit and cream, variety of flavors, reduced sugar",grains-cereals,376,10.16,7.46,2.09,71.57,17.66,8.3,559,0
173907,"Cereals, QUAKER, Instant Oatmeal, maple and brown sugar, dry",grains-cereals,368,9.2,4.63,0.79,76.91,30.02,7.2,506,0
174625,"Cereals, QUAKER, Instant Oatmeal, raisins, dates and walnuts, dry",grains-cereals,371,8.82,6.98,1.07,72.41,30.85,6.9,516,0
173926,"Cereals, QUAKER, Instant Oatmeal, weight control, cinnamon",grains-cereals,361,16.5,6.28,1.21,64.21,1.27,13,618,0
174626,"Cereals, QUAKER, Oat Bran, QUAKER/MOTHER'S Oat Bran, dry",grains-cereals,364,17.03,7.97,1.43,62.94,1.43,14.3,5,1
172972,"Cereals, QUAKER, QUAKER MultiGrain Oatmeal, dry",grains-cereals,334,12.64,2.73,0.45,72.62,2.46,11.9,7,1
174640,"Cereals, QUAKER, Quick Oats with Iron, Dry",grains-cereals,371,13.7,6.87,0.96,68.18,1.42,9.4,3,1
172989,"Cereals, QUAKER, Quick Oats, Dry",grains-cereals,371,13.7,6.87,1.11,68.18,1.42,9.4,3,1
173923,"Cereals, QUAKER, Weight Control Instant Oatmeal, banana bread",grains-cereals,361,16.5,6.16,1.19,64.42,1.29,12.6,619,1
173922,"Cereals, QUAKER, Weight Control Instant Oatmeal, maple and brown sugar",grains-cereals,361,16.37,6.2,1.16,64.25,1.25,13,642,1
174641,"Cereals, QUAKER, Whole Wheat Natural Cereal, dry",grains-cereals,333,11.8,2,0.42,74.8,2,9.9,8,1
173898,"Cereals, QUAKER, corn grits, instant, cheddar cheese flavor, dry",grains-cereals,363,8.98,5.46,1.33,72.96,2.76,4.2,1644,1
171656,"Cereals, QUAKER, corn grits, instant, plain, dry",grains-cereals,343,7.31,2.14,0.36,78.42,1.51,4.2,1121,1
174629,"Cereals, QUAKER, hominy grits, white, quick, dry",grains-cereals,348,8.8,1.2,0.16,79.6,0.3,4.8,1,1
174630,"Cereals, QUAKER, hominy grits, white, regular, dry",grains-cereals,361,8.8,1.6,0.15,79.2,0.64,1.6,1,1
171684,"Cereals, QUAKER, oatmeal, REAL MEDLEYS, apple walnut, dry",grains-cereals,390,8.18,10.36,1.3,70.53,29.36,7,356,1
171683,"Cereals, QUAKER, oatmeal, REAL MEDLEYS, blueberry hazelnut, dry",grains-cereals,386,9.81,9.8,1.65,69.47,18.71,7.7,337,1
173925,"Cereals, QUAKER, oatmeal, REAL MEDLEYS, cherry pistachio, dry",grains-cereals,394,12.02,11.02,1.39,66.73,26.34,7.1,181,0
173924,"Cereals, QUAKER, oatmeal, REAL MEDLEYS, peach almond, dry",grains-cereals,387,10.1,9.84,1.11,68.61,24.85,7.4,201,0
171685,"Cereals, QUAKER, oatmeal, REAL MEDLEYS, summer berry, dry",grains-cereals,353,11.31,4.4,1.04,72.58,20.43,8.5,354,0
171666,"Cereals, WHEATENA, cooked with water",grains-cereals,56,2,0.5,0.08,11.8,,2.7,2,1
171676,"Cereals, WHEATENA, cooked with water, with salt",grains-cereals,59,2.03,0.45,0.09,11.74,0.25,2,238,1
171665,"Cereals, WHEATENA, dry",grains-cereals,357,13.1,2.9,0.43,75.6,1.6,12.8,13,1
171671,"Cereals, corn grits, white, regular and quick, enriched, cooked with water, with salt",grains-cereals,71,1.71,0.46,0.07,14.76,0.12,0.8,223,1
171655,"Cereals, corn grits, white, regular and quick, enriched, cooked with water, without salt",grains-cereals,71,1.71,0.46,0.07,14.76,0.12,0.8,2,1
171654,"Cereals, corn grits, white, regular and quick, enriched, dry",grains-cereals,370,7.65,1.75,0.34,79.09,0.57,4.6,1,0
171672,"Cereals, corn grits, yellow, regular and quick, enriched, cooked with water, without salt",grains-cereals,65,1.23,0.39,0.06,13.86,0.09,0.7,2,0
171670,"Cereals, corn grits, yellow, regular and quick, unenriched, dry",grains-cereals,371,8.8,1.2,0.16,79.6,0.64,1.6,1,0
171673,"Cereals, corn grits, yellow, regular, quick, enriched, cooked with water, with salt",grains-cereals,65,1.23,0.39,0.06,13.86,0.09,0.7,223,0
171659,"Cereals, farina, enriched, assorted brands including CREAM OF WHEAT, quick (1-3 minutes), cooked with water, without salt",grains-cereals,55,1.82,0.34,0.07,10.92,0.76,0.8,18,1
171658,"Cereals, farina, enriched, assorted brands including CREAM OF WHEAT, quick (1-3 minutes), dry",grains-cereals,360,11.6,1.41,0.23,73.19,0.56,4.2,124,1
173917,"Cereals, farina, enriched, cooked with water, with salt",grains-cereals,53,1.82,0.34,0.07,10.92,0.76,0.8,126,0
173916,"Cereals, farina, unenriched, dry",grains-cereals,369,10.6,0.5,0.08,78,,1.9,3,1
173920,"Cereals, oats, instant, fortified, maple and brown sugar, dry",grains-cereals,386,9.25,4.73,0.78,76.67,30.28,7.2,505,1
171661,"Cereals, oats, instant, fortified, plain, dry",grains-cereals,362,11.92,6.9,1.35,69.52,1.5,10,220,1
171664,"Cereals, oats, instant, fortified, with cinnamon and spice, dry",grains-cereals,369,9.53,4.84,0.77,76.08,25.33,8,434,0
171675,"Cereals, oats, regular and quick and instant, unenriched, cooked with water (includes boiling and microwaving), with salt",grains-cereals,71,2.54,1.52,0.31,12,0.27,1.7,71,1
173904,"Cereals, oats, regular and quick, not fortified, dry",grains-cereals,379,13.15,6.52,1.11,67.7,0.99,10.1,6,1
173905,"Cereals, oats, regular and quick, unenriched, cooked with water (includes boiling and microwaving), without salt",grains-cereals,71,2.54,1.52,0.31,12,0.27,1.7,4,0
171678,"Cereals, ready-to-eat, MALT-O-MEAL, Blueberry Mini SPOONERS",grains-cereals,350,8.81,1.92,0.4,79.4,18.44,10.3,2,0
171677,"Cereals, whole wheat hot natural cereal, cooked with water, with salt",grains-cereals,62,2,0.4,0.06,13.7,0.08,1.6,233,1
171668,"Cereals, whole wheat hot natural cereal, cooked with water, without salt",grains-cereals,62,2,0.4,0.06,13.7,0.08,1.6,0,1
171667,"Cereals, whole wheat hot natural cereal, dry",grains-cereals,342,11.2,2,0.3,75.2,0.42,9.5,2,0
170289,"Corn bran, crude",grains-cereals,224,8.36,0.92,0.13,85.64,0,79,7,1
169694,"Corn flour, masa, enriched, white",grains-cereals,363,8.46,3.69,0.53,76.59,1.61,6.4,5,1
169696,"Corn flour, masa, unenriched, white",grains-cereals,363,8.46,3.69,0.53,76.59,1.61,6.4,5,0
168921,"Corn flour, whole-grain, blue (harina de maiz morado)",grains-cereals,364,8.75,5.09,,73.89,,8.4,5,1
169748,"Corn flour, whole-grain, white",grains-cereals,361,6.93,3.86,0.54,76.85,0.64,7.3,5,1
170290,"Corn flour, whole-grain, yellow",grains-cereals,361,6.93,3.86,0.54,76.85,0.64,7.3,5,0
169695,"Corn flour, yellow, degermed, unenriched",grains-cereals,375,5.59,1.39,0.17,82.75,0.64,1.9,1,1
169749,"Corn flour, yellow, masa, enriched",grains-cereals,363,8.46,3.69,0.53,76.59,,6.4,5,1
168920,"Corn grain, white",grains-cereals,365,9.42,4.74,0.67,74.26,,,35,1
170288,"Corn grain, yellow",grains-cereals,365,9.42,4.74,0.67,74.26,0.64,7.3,35,1
168922,"Cornmeal, degermed, enriched, white",grains-cereals,370,7.11,1.75,0.22,79.45,1.61,3.9,7,1
168867,"Cornmeal, degermed, enriched, yellow",grains-cereals,370,7.11,1.75,0.22,79.45,1.61,3.9,7,1
172015,"Cornmeal, degermed, unenriched, white",grains-cereals,370,7.11,1.75,0.22,79.45,1.61,3.9,7,1
168929,"Cornmeal, degermed, unenriched, yellow",grains-cereals,370,7.11,1.75,0.22,79.45,1.61,3.9,7,1
168923,"Cornmeal, white, self-rising, bolted, plain, enriched",grains-cereals,334,8.28,3.4,0.48,70.28,,6.7,1247,1
168924,"Cornmeal, white, self-rising, bolted, with wheat flour added, enriched",grains-cereals,348,8.41,2.85,0.4,73.43,,6.3,1319,1
168925,"Cornmeal, white, self-rising, degermed, enriched",grains-cereals,355,8.41,1.72,0.23,74.79,,7.1,1348,0
169750,"Cornmeal, whole-grain, white",grains-cereals,362,8.12,3.59,0.51,76.89,0.64,7.3,35,1
169697,"Cornmeal, whole-grain, yellow",grains-cereals,362,8.12,3.59,0.51,76.89,0.64,7.3,35,1
168868,"Cornmeal, yellow, self-rising, bolted, plain, enriched",grains-cereals,334,8.28,3.4,0.48,70.28,,6.7,1247,1
168869,"Cornmeal, yellow, self-rising, bolted, with wheat flour added, enriched",grains-cereals,348,8.41,2.85,0.4,73.43,,6.3,1319,1
168870,"Cornmeal, yellow, self-rising, degermed, enriched",grains-cereals,355,8.41,1.72,0.23,74.79,,7.1,1348,0
169698,Cornstarch,grains-cereals,381,0.26,0.05,0.01,91.27,0,0.9,9,1
169700,"Couscous, cooked",grains-cereals,112,3.79,0.16,0.03,23.22,0.1,1.4,5,1
169699,"Couscous, dry",grains-cereals,376,12.76,0.64,0.12,77.43,,5,10,1
790146,"Flour, bread, white, enriched, unbleached",grains-cereals,363,14.3,1.65,,72.8,,,3,1
790276,"Flour, corn, yellow, fine meal, enriched",grains-cereals,364,6.2,1.74,,80.8,,4.3,0,1
1104913,"Flour, pastry, unenriched, unbleached",grains-cereals,358,8.75,1.64,,77.2,,,1,1
1104812,"Flour, rice, brown",grains-cereals,365.25,7.19,3.85,,75.5,,,1,1
1104867,"Flour, rice, glutinous",grains-cereals,358,6.69,1.16,,80.1,,,6,1
790214,"Flour, rice, white, unenriched",grains-cereals,359,6.94,1.3,,79.8,,0.5,5,1
789890,"Flour, wheat, all-purpose, enriched, bleached",grains-cereals,366,10.9,1.48,,77.3,,,2,1
789951,"Flour, wheat, all-purpose, enriched, unbleached",grains-cereals,358,13.1,1.48,,73.2,,,4,1
790018,"Flour, wheat, all-purpose, unenriched, unbleached",grains-cereals,362,12,1.7,,74.6,,3,2,0
790085,"Flour, whole wheat, unenriched",grains-cereals,370,15.1,2.73,,71.2,,10.6,3,1
169701,"Hominy, canned, white",grains-cereals,72,1.48,0.88,0.12,14.26,1.51,2.5,267,1
169752,"Hominy, canned, yellow",grains-cereals,72,1.48,0.88,0.12,14.26,,2.5,345,1
168904,"Macaroni, vegetable, enriched, cooked",grains-cereals,128,4.53,0.11,0.02,26.61,1.15,4.3,6,1
168903,"Macaroni, vegetable, enriched, dry",grains-cereals,367,13.14,1.04,0.15,74.88,,4.3,43,1
172023,"Millet flour",grains-cereals,382,10.75,4.25,0.54,75.12,1.66,3.5,4,1
168871,"Millet, cooked",grains-cereals,119,3.51,1,0.17,23.67,0.13,1.3,2,1
167724,"Millet, puffed",grains-cereals,354,13,3.4,0.67,80,0.55,2.7,5,1
169702,"Millet, raw",grains-cereals,378,11.02,4.22,0.72,72.85,,8.5,5,1
168905,"Noodles, chinese, chow mein",grains-cereals,471,10.88,21.24,6.74,63.64,0,6.7,866,1
168919,"Noodles, egg, cooked, enriched, with added salt",grains-cereals,138,4.54,2.07,0.42,25.16,0.4,1.2,165,1
169762,"Noodles, egg, cooked, unenriched, with added salt",grains-cereals,138,4.54,2.07,0.42,25.16,0.4,1.2,165,1
169731,"Noodles, egg, dry, enriched",grains-cereals,384,14.16,4.44,1.18,71.27,1.88,3.3,21,1
169755,"Noodles, egg, dry, unenriched",grains-cereals,384,14.16,4.44,1.18,71.27,1.88,3.3,21,1
169732,"Noodles, egg, enriched, cooked",grains-cereals,138,4.54,2.07,0.42,25.16,0.4,1.2,5,1
